row_type,name,status_or_metric,value,unit,query_advance_ratio_j,query_rpm,observed_neighbor_rows,minimum_neighbor_rows_required,ct_coefficient,cp_coefficient,eta,max_ct_shape_overshoot,min_cp_coefficient,eta_residual,static_anchor_error,archive_curve_shape_guard_inherited,negative_thrust_tail_execution_input_rows,archive_curve_eta_formula_residual,archive_curve_ct_increase,runtime_coupling_allowed,gameplay_auto_apply_allowed,next_required_action,note
propeller_archive_ct_cp_j_lookup_execution_source,propeller_archive_fingerprint,source,PropellerArchiveSourceFingerprint,java,,,,,,,,,,,,,,,,false,false,review-source-license-before-binding-rows,source identity and current import boundary
propeller_archive_ct_cp_j_lookup_execution_source,lookup_seed,source,PropellerArchiveCtCpJLookupSeed,java,,,,,,,,,,,,,,,,false,false,feed-reviewed-rows-from-offline-import,defines CT/CP/J payload fields and preset domains
propeller_archive_ct_cp_j_lookup_execution_source,query_envelope,source,PropellerArchiveCtCpJLookupQueryEnvelope,java,,,,,,,,,,,,,,,,false,false,reject-query-until-reviewed-extrapolation-policy,defines deterministic J/RPM query cases
propeller_archive_ct_cp_j_lookup_execution_source,interpolation_policy,source,PropellerArchiveCtCpJLookupInterpolationPolicy,java,,,,,,,,,,,,,,,,false,false,validate-reviewed-row-grid-before-execution,defines minimum neighbor and guard policy
propeller_archive_ct_cp_j_lookup_execution_source,scattered_fit_execution_handoff,source,PropellerArchiveCtCpJScatteredSurfaceFitExecutionHandoff,java,,,,,,,,,,,,,,,,false,false,complete-scattered-surface-fit-execution-handoff-before-lookup-run,requires fit-ready execution input shape before lookup runner consumes rows
propeller_archive_ct_cp_j_lookup_execution_source,acceptance_gate,source,PropellerArchiveCtCpJLookupAcceptanceGate,java,,,,,,,,,,,,,,,,false,false,feed-acceptance-gate-with-execution-results,receives observed neighbor/shape/power/eta/static metrics
propeller_archive_ct_cp_j_lookup_execution_source,openfoam_lookup_support,source,PropellerArchiveCtCpJOpenFoamLookupSupportGate,java,,,,,,,,,,,,,,,,false,false,keep-cfd-support-separate-from-wind-tunnel-acceptance,CFD support cannot replace reviewed lookup acceptance
propeller_archive_ct_cp_j_lookup_execution_source,execution_contract,source,PropellerArchiveCtCpJLookupExecutionContract,java,,,,,,,,,,,,,,,,false,false,complete-scattered-surface-fit-execution-handoff-before-lookup-run,this packet
propeller_archive_ct_cp_j_lookup_execution_rule,source_license_review,required,false,boolean,,,,,,,,,,,,,,,,false,false,review-source-license-before-binding-rows,raw propeller rows must be reviewed before execution input can be trusted
propeller_archive_ct_cp_j_lookup_execution_rule,caller_supplied_reviewed_rows,required,false,boolean,,,,,,,,,,,,,,,,false,false,feed-reviewed-rows-from-offline-import,runner receives reviewed rows from offline import path only
propeller_archive_ct_cp_j_lookup_execution_rule,scattered_fit_execution_handoff_ready,required,false,boolean,,,,,,,,,,,,,,,,false,false,complete-scattered-surface-fit-execution-handoff-before-lookup-run,handoff must be ready before execution consumes reviewed rows
propeller_archive_ct_cp_j_lookup_execution_rule,archive_curve_shape_guard_inherited,required,false,boolean,,,,,,,,,,,,,,,,false,false,carry-archive-curve-shape-guard-into-lookup-execution,lookup execution must inherit curve-shape diagnostics from the handoff
propeller_archive_ct_cp_j_lookup_execution_rule,finite_sorted_grid,required,false,boolean,,,,,,,,,,,,,,,,false,false,validate-reviewed-row-grid-before-execution,J/RPM grid rows must be finite positive and duplicate-free
propeller_archive_ct_cp_j_lookup_execution_rule,reject_extrapolation,required,true,boolean,,,,,,,,,,,,,,,,false,false,keep-extrapolation-disabled-until-reviewed,queries outside reviewed J/RPM brackets are rejected
propeller_archive_ct_cp_j_lookup_execution_rule,minimum_neighbor_rows,required,false,boolean,,,,,,,,,,,,,,,,false,false,feed-all-required-bracketing-neighbors,observed neighbors must meet interpolation policy
propeller_archive_ct_cp_j_lookup_execution_rule,shape_preserving_ct,required,false,boolean,,,,,,,,,,,,,,,,false,false,verify-ct-shape-guard-before-acceptance,interpolated CT cannot exceed neighbor extrema
propeller_archive_ct_cp_j_lookup_execution_rule,cp_eta_static_guards,required,false,boolean,,,,,,,,,,,,,,,,false,false,verify-cp-eta-static-guards-before-acceptance,CP positive eta-consistent and static anchors exact
propeller_archive_ct_cp_j_lookup_execution_rule,runtime_leak_guard,required,true,boolean,,,,,,,,,,,,,,,,false,false,keep-runtime-coupling-and-gameplay-auto-apply-closed,execution results cannot mutate runtime or gameplay tuning
propeller_archive_ct_cp_j_lookup_execution_scenario,current_handoff_blocked_no_execution,HANDOFF_BLOCKED,false,boolean,0.406400,4712.25,0,4,0.000000,0.000000,0.000000,0.000000,0.000000,0.000000,0.000000,false,0,0.000000,0.000000,false,false,complete-scattered-surface-fit-execution-handoff-before-lookup-run,source review and scattered fit handoff block execution before rows reach lookup runner
propeller_archive_ct_cp_j_lookup_execution_scenario,current_no_reviewed_rows,NO_REVIEWED_ROWS,false,boolean,0.406400,4712.25,0,4,0.000000,0.000000,0.000000,0.000000,0.000000,0.000000,0.000000,false,0,0.000000,0.000000,false,false,feed-reviewed-rows-from-offline-import,current sim/lab state has no reviewed raw CT/CP/J rows bound to execution
propeller_archive_ct_cp_j_lookup_execution_scenario,synthetic_handoff_curve_shape_guard_blocked,HANDOFF_CURVE_SHAPE_GUARD_FAILED,false,boolean,0.406400,4712.25,0,4,0.000000,0.000000,0.000000,0.000000,0.000000,0.000000,0.000000,false,9,0.00027500814692071884,0.000071,false,false,carry-archive-curve-shape-guard-into-lookup-execution,handoff cannot expose lookup rows without inherited archive curve-shape guard
propeller_archive_ct_cp_j_lookup_execution_scenario,synthetic_static_anchor_exact,ACCEPTED,true,boolean,0.000000,1477.80,1,1,0.120000,0.040000,0.000000,0.000000,0.040000,0.000000,0.000000,true,9,0.00027500814692071884,0.000071,false,false,feed-acceptance-gate-with-execution-results,J-zero anchor is exactly recoverable when reviewed row exists
propeller_archive_ct_cp_j_lookup_execution_scenario,synthetic_mid_bilinear_pass,ACCEPTED,true,boolean,0.406400,4712.25,4,4,0.093250,0.050750,0.746735,0.000000,0.046000,0.000000,0.000000,true,9,0.00027500814692071884,0.000071,false,false,feed-acceptance-gate-with-execution-results,bracketed J/RPM query passes neighbor shape CP eta guards
propeller_archive_ct_cp_j_lookup_execution_scenario,synthetic_missing_neighbor_blocked,NEIGHBOR_ROWS_MISSING,false,boolean,0.406400,4712.25,3,4,0.000000,0.000000,0.000000,0.000000,0.000000,0.000000,0.000000,true,9,0.00027500814692071884,0.000071,false,false,feed-all-required-bracketing-neighbors,one bilinear corner is absent so acceptance cannot pass
propeller_archive_ct_cp_j_lookup_execution_scenario,synthetic_high_j_extrapolation_rejected,OUT_OF_DOMAIN,false,boolean,0.934720,7946.70,0,0,0.000000,0.000000,0.000000,0.000000,0.000000,0.000000,0.000000,true,9,0.00027500814692071884,0.000071,false,false,keep-extrapolation-disabled-until-reviewed,high-J probe remains rejected outside reviewed lookup domain
propeller_archive_ct_cp_j_lookup_execution_scenario,synthetic_cp_guard_failed,ACCEPTANCE_GUARD_FAILED,false,boolean,0.406400,4712.25,4,4,0.093250,0.00000005075,746734.975369,0.000000,0.00000004600,0.000000,0.000000,true,9,0.00027500814692071884,0.000071,false,false,verify-cp-eta-static-guards-before-acceptance,positive but too-small CP fails acceptance guard
propeller_archive_ct_cp_j_lookup_execution_summary,all_scenarios,scenario_count,8,count,,,,,,,,,,,,,,,,false,false,complete-scattered-surface-fit-execution-handoff-before-lookup-run,total execution scenarios
propeller_archive_ct_cp_j_lookup_execution_summary,all_scenarios,accepted_scenario_count,2,count,,,,,,,,,,,,,,,,false,false,feed-acceptance-gate-with-execution-results,static anchor and mid-domain synthetic cases pass
propeller_archive_ct_cp_j_lookup_execution_summary,all_scenarios,blocked_scenario_count,6,count,,,,,,,,,,,,,,,,false,false,resolve-blocked-execution-scenarios,handoff shape guard no rows extrapolation missing-neighbor and CP guard cases block
propeller_archive_ct_cp_j_lookup_execution_summary,all_scenarios,handoff_blocked_scenario_count,2,count,,,,,,,,,,,,,,,,false,false,complete-scattered-surface-fit-execution-handoff-before-lookup-run,current handoff and shape guard checks can block execution
propeller_archive_ct_cp_j_lookup_execution_summary,all_scenarios,no_reviewed_rows_scenario_count,1,count,,,,,,,,,,,,,,,,false,false,feed-reviewed-rows-from-offline-import,current execution is blocked without reviewed rows
propeller_archive_ct_cp_j_lookup_execution_summary,all_scenarios,out_of_domain_scenario_count,1,count,,,,,,,,,,,,,,,,false,false,keep-extrapolation-disabled-until-reviewed,high-J probe rejected
propeller_archive_ct_cp_j_lookup_execution_summary,all_scenarios,missing_neighbor_scenario_count,1,count,,,,,,,,,,,,,,,,false,false,feed-all-required-bracketing-neighbors,bilinear query requires four neighbors
propeller_archive_ct_cp_j_lookup_execution_summary,all_scenarios,acceptance_guard_failed_scenario_count,1,count,,,,,,,,,,,,,,,,false,false,verify-cp-eta-static-guards-before-acceptance,CP threshold catches bad reviewed row set
propeller_archive_ct_cp_j_lookup_execution_summary,all_scenarios,archive_curve_shape_guard_inherited_scenario_count,5,count,,,,,,,,,,,,,,,,false,false,carry-archive-curve-shape-guard-into-lookup-execution,handoff-ready synthetic execution rows carry archive curve-shape diagnostics
propeller_archive_ct_cp_j_lookup_execution_summary,all_scenarios,archive_curve_shape_guard_blocked_scenario_count,1,count,,,,,,,,,,,,,,,,false,false,carry-archive-curve-shape-guard-into-lookup-execution,lookup execution blocks if archive curve-shape coverage is incomplete
propeller_archive_ct_cp_j_lookup_execution_summary,all_scenarios,max_observed_neighbor_rows,4,count,,,,,,,,,,,,,,,,false,false,feed-acceptance-gate-with-execution-results,max bilinear neighbor count
propeller_archive_ct_cp_j_lookup_execution_summary,all_scenarios,max_negative_thrust_tail_execution_input_rows,9,count,,,,,,,,,,,,,,,,false,false,carry-archive-curve-shape-guard-into-lookup-execution,all inherited execution rows come from curves with reviewed negative high-J tails
propeller_archive_ct_cp_j_lookup_execution_summary,all_scenarios,max_ct_shape_overshoot,0.000000,coefficient,,,,,,,,,,,,,,,,false,false,verify-ct-shape-guard-before-acceptance,synthetic bilinear interpolation stays inside neighbor extrema
propeller_archive_ct_cp_j_lookup_execution_summary,all_scenarios,min_accepted_cp_coefficient,0.040000,coefficient,,,,,,,,,,,,,,,,false,false,verify-cp-eta-static-guards-before-acceptance,minimum accepted CP remains positive
propeller_archive_ct_cp_j_lookup_execution_summary,all_scenarios,max_archive_curve_eta_formula_residual,0.00027500814692071884,ratio,,,,,,,,,,,,,,,,false,false,carry-archive-curve-shape-guard-into-lookup-execution,inherited archive eta formula residual stays inside shape-review tolerance
propeller_archive_ct_cp_j_lookup_execution_summary,all_scenarios,max_archive_curve_ct_increase,0.000071,coefficient,,,,,,,,,,,,,,,,false,false,carry-archive-curve-shape-guard-into-lookup-execution,inherited archive CT monotonic diagnostic stays inside tolerance
propeller_archive_ct_cp_j_lookup_execution_summary,all_scenarios,runtime_coupling_allowed_count,0,count,,,,,,,,,,,,,,,,false,false,keep-runtime-coupling-and-gameplay-auto-apply-closed,execution result never opens runtime coupling
propeller_archive_ct_cp_j_lookup_execution_summary,all_scenarios,gameplay_auto_apply_allowed_count,0,count,,,,,,,,,,,,,,,,false,false,keep-runtime-coupling-and-gameplay-auto-apply-closed,execution result never auto-applies gameplay tuning
propeller_archive_ct_cp_j_lookup_execution_method,all,method_note,execute-handoff-inherited-reviewed-ct-cp-j-rows-with-bracketed-interpolation-shape-guard-and-runtime-leak-checks,text,,,,,,,,,,,,,,,,false,false,keep-raw-data-out-of-repository,no raw wind-tunnel rows or fitted coefficients are vendored
